{
  "meta": {
    "schema_version": "1.0",
    "project": "PLAYMUSEUM",
    "exhibition": "국립중앙박물관 상설전시관 (서화실 그림 포함)",
    "updated": "2026-10-26",
    "author": "콘텐츠 큐레이션 담당",
    "counts": {
      "records": 8,
      "scripts": 48,
      "sentences": 245,
      "labels": {
        "fact": 188,
        "interpretation": 31,
        "conjecture": 21,
        "legend": 5
      },
      "courses": 8,
      "sources": 23
    },
    "notes": [
      "label이 fact가 아닌 문장은 화면에 라벨 칩, 음성에 신호어를 붙인다.",
      "sources는 레코드 단위 출처 ID다. 문장별 출처 매핑은 아직 없다.",
      "on_view: true=전시 중, false=전시 안 함(코스에서 제외), null=확인 전(시연에서는 포함).",
      "오디오·이미지 파일명은 규칙에 맞춘 자리표시자이며 실제 파일은 아직 없다."
    ]
  },
  "labels": {
    "fact": {
      "name": "사실",
      "voice_cue": ""
    },
    "interpretation": {
      "name": "해석",
      "voice_cue": "학자들은 ~로 봅니다"
    },
    "conjecture": {
      "name": "추정",
      "voice_cue": "확실하지 않지만 / ~라는 설이 있습니다"
    },
    "legend": {
      "name": "전설",
      "voice_cue": "~라고 전해집니다"
    }
  },
  "tastes": [
    {
      "key": "history",
      "label": "역사적 사건과 시대의 변화",
      "maps_to": {
        "lens": "history"
      }
    },
    {
      "key": "people",
      "label": "인물 관계, 사랑, 갈등, 권력의 뒷이야기",
      "maps_to": {
        "lens": "people"
      }
    },
    {
      "key": "craft",
      "label": "색과 형태, 아름다움, 제작 기술",
      "maps_to": {
        "lens": "craft"
      }
    },
    {
      "key": "mystery",
      "label": "미스터리와 숨겨진 의미",
      "maps_to": {
        "lens": "mystery"
      }
    },
    {
      "key": "daily",
      "label": "과거 사람들의 일상과 생활",
      "maps_to": {
        "lens": "daily"
      }
    },
    {
      "key": "music",
      "label": "음악과 분위기를 통한 감각적 감상",
      "maps_to": {
        "lens": "craft",
        "sound_default": true,
        "course": "C08"
      }
    }
  ],
  "lenses": [
    {
      "key": "history",
      "name": "역사",
      "question": "이 유물은 어떤 시대를 지나왔나?"
    },
    {
      "key": "people",
      "name": "인물·관계",
      "question": "이 유물 곁에는 누가 있었나?"
    },
    {
      "key": "craft",
      "name": "미감·기술",
      "question": "어떻게 만들었고, 어디를 봐야 하나?"
    },
    {
      "key": "mystery",
      "name": "미스터리",
      "question": "아직 풀리지 않은 것은 무엇인가?"
    },
    {
      "key": "daily",
      "name": "일상",
      "question": "당시 사람들에게 이것은 무엇이었나?"
    }
  ],
  "artifacts": [
    {
      "id": "A01",
      "type": "object",
      "name": "경천사 십층석탑",
      "album": null,
      "era": "고려, 1348년(명문)",
      "material": "대리석, 높이 13.5m, 10층",
      "designation": "국보(1962)",
      "location": {
        "floor": 1,
        "room": "역사의 길"
      },
      "on_view": true,
      "strong_lenses": [
        "people",
        "history",
        "mystery"
      ],
      "image": {
        "file": "A01.jpg",
        "credit": "",
        "license": "확인 필요(공공누리 유형)"
      },
      "base": {
        "text": "국립중앙박물관 1층 '역사의 길' 끝에 선 높이 13.5m의 석탑입니다. 1층 탑신의 명문에 따르면 고려 충목왕 4년, 1348년에 경천사라는 절에 세워졌습니다. 우리나라 석탑 대부분이 화강암인 것과 달리 대리석으로 만들었고, 층마다 사자·용·연꽃과 불교 이야기 장면이 빽빽하게 새겨져 있습니다. 1962년 국보로 지정됐습니다.",
        "chars": 183,
        "est_seconds": 43,
        "audio": "A01_base.mp3",
        "sentences": [
          {
            "id": "A01.base.1",
            "label": "fact",
            "text": "국립중앙박물관 1층 '역사의 길' 끝에 선 높이 13.5m의 석탑입니다."
          },
          {
            "id": "A01.base.2",
            "label": "fact",
            "text": "1층 탑신의 명문에 따르면 고려 충목왕 4년, 1348년에 경천사라는 절에 세워졌습니다."
          },
          {
            "id": "A01.base.3",
            "label": "fact",
            "text": "우리나라 석탑 대부분이 화강암인 것과 달리 대리석으로 만들었고, 층마다 사자·용·연꽃과 불교 이야기 장면이 빽빽하게 새겨져 있습니다."
          },
          {
            "id": "A01.base.4",
            "label": "fact",
            "text": "1962년 국보로 지정됐습니다."
          }
        ]
      },
      "lenses": {
        "history": {
          "text": "이 탑은 두 번의 격동기를 지나왔습니다. 첫 번째는 탑이 세워진 1348년, 고려가 원나라의 간섭을 받던 시기입니다. 학자들은 탑의 명문을 근거로 이 탑이 원 황실을 위해 세워졌다고 봅니다. 기단과 아래 세 층의 독특한 모양에 몽골·티베트 불교의 영향이 보인다는 평가도 이 시대를 말해 줍니다. 두 번째는 근대입니다. 1907년 일본으로 반출됐다가 1918년 돌아왔지만 해체된 채 오래 방치됐고, 1960년에야 경복궁에 다시 세워졌습니다. 산성비에 약한 대리석이 상하자 1995년부터 약 10년간 보존처리를 거쳐, 2005년 지금의 실내 자리로 옮겨졌습니다.",
          "chars": 312,
          "est_seconds": 73,
          "audio": "A01_history.mp3",
          "sentences": [
            {
              "id": "A01.history.1",
              "label": "fact",
              "text": "이 탑은 두 번의 격동기를 지나왔습니다."
            },
            {
              "id": "A01.history.2",
              "label": "fact",
              "text": "첫 번째는 탑이 세워진 1348년, 고려가 원나라의 간섭을 받던 시기입니다."
            },
            {
              "id": "A01.history.3",
              "label": "interpretation",
              "text": "학자들은 탑의 명문을 근거로 이 탑이 원 황실을 위해 세워졌다고 봅니다."
            },
            {
              "id": "A01.history.4",
              "label": "interpretation",
              "text": "기단과 아래 세 층의 독특한 모양에 몽골·티베트 불교의 영향이 보인다는 평가도 이 시대를 말해 줍니다."
            },
            {
              "id": "A01.history.5",
              "label": "fact",
              "text": "두 번째는 근대입니다."
            },
            {
              "id": "A01.history.6",
              "label": "fact",
              "text": "1907년 일본으로 반출됐다가 1918년 돌아왔지만 해체된 채 오래 방치됐고, 1960년에야 경복궁에 다시 세워졌습니다."
            },
            {
              "id": "A01.history.7",
              "label": "fact",
              "text": "산성비에 약한 대리석이 상하자 1995년부터 약 10년간 보존처리를 거쳐, 2005년 지금의 실내 자리로 옮겨졌습니다."
            }
          ]
        },
        "people": {
          "text": "1907년, 황태자(순종)의 혼례 축하 사절로 대한제국에 온 일본 궁내대신 다나카 미쓰아키가 이 탑을 해체해 일본으로 실어 갔습니다. 이 사실을 세상에 알린 건 두 외국인이었습니다. 영국인 언론인 어니스트 베델은 자신이 만든 신문에 반출을 보도했고, 대한매일신보는 1907년 3월 7일자로 이 사건을 폭로했습니다. 미국인 호머 헐버트는 직접 현장을 확인한 뒤 언론에 글을 실었습니다. 비판이 이어진 끝에 탑은 1918년 돌아왔습니다. 학자들은 이런 국제 여론이 반환에 힘을 보탰다고 봅니다. 임진왜란 때 가토 기요마사가 이 탑을 탐냈다는 이야기가 다나카의 귀에 들어갔다는 말도 전해집니다.",
          "chars": 329,
          "est_seconds": 77,
          "audio": "A01_people.mp3",
          "sentences": [
            {
              "id": "A01.people.1",
              "label": "fact",
              "text": "1907년, 황태자(순종)의 혼례 축하 사절로 대한제국에 온 일본 궁내대신 다나카 미쓰아키가 이 탑을 해체해 일본으로 실어 갔습니다."
            },
            {
              "id": "A01.people.2",
              "label": "fact",
              "text": "이 사실을 세상에 알린 건 두 외국인이었습니다."
            },
            {
              "id": "A01.people.3",
              "label": "fact",
              "text": "영국인 언론인 어니스트 베델은 자신이 만든 신문에 반출을 보도했고, 대한매일신보는 1907년 3월 7일자로 이 사건을 폭로했습니다."
            },
            {
              "id": "A01.people.4",
              "label": "fact",
              "text": "미국인 호머 헐버트는 직접 현장을 확인한 뒤 언론에 글을 실었습니다."
            },
            {
              "id": "A01.people.5",
              "label": "fact",
              "text": "비판이 이어진 끝에 탑은 1918년 돌아왔습니다."
            },
            {
              "id": "A01.people.6",
              "label": "interpretation",
              "text": "학자들은 이런 국제 여론이 반환에 힘을 보탰다고 봅니다."
            },
            {
              "id": "A01.people.7",
              "label": "legend",
              "text": "임진왜란 때 가토 기요마사가 이 탑을 탐냈다는 이야기가 다나카의 귀에 들어갔다는 말도 전해집니다."
            }
          ]
        },
        "craft": {
          "text": "먼저 재료를 보세요. 결이 고운 대리석이라 조각을 아주 섬세하게 새길 수 있었지만, 그 대가로 산성비에 약했습니다. 다음은 형태입니다. 기단과 1~3층은 평면이 '亞'자처럼 꺾여 나온 20각형이고, 4~10층은 사각형입니다. 마지막으로 조각을 아래에서 위로 따라가 보세요. 기단에는 사자·용·연꽃과 『서유기』 장면, 2~4층에는 불교 법회 장면, 5~10층에는 수행하는 보살이 마침내 부처가 되는 과정이 이어집니다. 국립중앙박물관 학예연구관은 이만큼 조각이 빽빽한 석탑은 역사상 드물다고 설명합니다. 이 탑은 142개의 돌을 짜 맞춘 구조이기도 합니다.",
          "chars": 309,
          "est_seconds": 72,
          "audio": "A01_craft.mp3",
          "sentences": [
            {
              "id": "A01.craft.1",
              "label": "fact",
              "text": "먼저 재료를 보세요."
            },
            {
              "id": "A01.craft.2",
              "label": "fact",
              "text": "결이 고운 대리석이라 조각을 아주 섬세하게 새길 수 있었지만, 그 대가로 산성비에 약했습니다."
            },
            {
              "id": "A01.craft.3",
              "label": "fact",
              "text": "다음은 형태입니다."
            },
            {
              "id": "A01.craft.4",
              "label": "fact",
              "text": "기단과 1~3층은 평면이 '亞'자처럼 꺾여 나온 20각형이고, 4~10층은 사각형입니다."
            },
            {
              "id": "A01.craft.5",
              "label": "fact",
              "text": "마지막으로 조각을 아래에서 위로 따라가 보세요."
            },
            {
              "id": "A01.craft.6",
              "label": "fact",
              "text": "기단에는 사자·용·연꽃과 『서유기』 장면, 2~4층에는 불교 법회 장면, 5~10층에는 수행하는 보살이 마침내 부처가 되는 과정이 이어집니다."
            },
            {
              "id": "A01.craft.7",
              "label": "fact",
              "text": "국립중앙박물관 학예연구관은 이만큼 조각이 빽빽한 석탑은 역사상 드물다고 설명합니다."
            },
            {
              "id": "A01.craft.8",
              "label": "fact",
              "text": "이 탑은 142개의 돌을 짜 맞춘 구조이기도 합니다."
            }
          ]
        },
        "mystery": {
          "text": "기단에서 삼장법사와 손오공 일행을 찾아보세요. 그런데 이상한 점이 있습니다. 우리가 아는 소설 『서유기』는 16세기 명나라에서 완성됐는데, 이 탑은 1348년에 세워졌습니다. 소설보다 200년 가까이 앞선 셈입니다. 학자들은 삼장법사의 여행 이야기가 소설 이전부터 여러 형태로 퍼져 있었다고 봅니다. 두 번째 질문도 있습니다. 약 120년 뒤인 1467년, 조선 세조의 명으로 서울에 비슷한 모양의 원각사 십층석탑이 세워졌습니다. 그래서 고려 때 이런 이야기 구성을 담은 일종의 '제작 지침서'가 있었고 그것이 전해졌다는 연구들이 있습니다.",
          "chars": 302,
          "est_seconds": 70,
          "audio": "A01_mystery.mp3",
          "sentences": [
            {
              "id": "A01.mystery.1",
              "label": "fact",
              "text": "기단에서 삼장법사와 손오공 일행을 찾아보세요."
            },
            {
              "id": "A01.mystery.2",
              "label": "fact",
              "text": "그런데 이상한 점이 있습니다."
            },
            {
              "id": "A01.mystery.3",
              "label": "fact",
              "text": "우리가 아는 소설 『서유기』는 16세기 명나라에서 완성됐는데, 이 탑은 1348년에 세워졌습니다."
            },
            {
              "id": "A01.mystery.4",
              "label": "fact",
              "text": "소설보다 200년 가까이 앞선 셈입니다."
            },